lookup,Act and section under which proceedings can be taken,Offence description10814,Abandonment of Animals Act 1960,Abandonment of animals19599,Abortion Act 1967,Failure to comply with regulations15901,Access to Justice Act 1999 ,Restriction of disclosure of information15902,Access to Justice Act 1999 ,Misrepresentations - making statement or representation known to be false9551,Access to Justice Act 1999 ,Without authority disclosing or using information19455,Accession (Immigration and Worker Authorisation) Regulations 2006,Employing Accession State national subject to worker authorisation in accession period not holder of authorisation document19456,Accession (Immigration and Worker Authorisation) Regulations 2006,Accession State national subject to worker authorisation working in UK during accession period19457,Accession (Immigration and Worker Authorisation) Regulations 2006,Obtaining or seeking to obtain an accession worker card by means including deception19599,Accommodation Agencies Act 1953,The taking of certain commissions dealing with letting of houses and flats9934,Activity Centres (Young Persons Safety) Act 1995 ,Failure to possess a licence or to obey conditions of licence9935,Activity Centres (Young Persons Safety) Act 1995 ,Making statement to the licensing authority (or someone acting on their behalf) which is false in a material particular19599,Administration of Justice Act 1970 ,Harassment of debtors9802,Adoption Act 1976,TEW offences19628,Adoption Act 1976,Summary offences9803,Adoption and Children Act 2002,TEW offences19629,Adoption and Children Act 2002,Summary offences5313,Agricultural Credits Act 1928,Frauds by farmers relating to agricultural charges9999,Agricultural Marketing Act 1958,Contravening sales of regulated products or disclosing information9999,Agriculture Act 1967 ,Misrepresentation of systems of classification of carcasses19599,Agriculture Act 1967,Failure to comply with requirements made under the levy scheme by virtue of subsection 19999,Agriculture Act 1967,Falsification of registration returns and records of a levy scheme9999,Agriculture Act 1967,Disclosure of information under a levy scheme9999,Agriculture Act 1967,Means of obtaining information relating to land19599,Agriculture Act 1967,Livestock and meat marketing regulations10102,Agriculture Act 1970,Any offence relating to fertilisers and feeding stuffs9999,Agriculture Act 1970,Offences concerning: eggs; capital and other grants; smallholdings; flood warning systems; animal diseases19533,Agriculture and Horticulture Act 1964,Offences concerning: price stability of imported produce; grants; grading and transport of fresh horticultural produce19599,Agriculture (Miscellaneous Provisions) Act 1968,False entries in documents; grants for break crops10821,Agriculture (Miscellaneous Provisions) Act 1968,Prevention of unnecessary pain and distress for livestock10821,Agriculture (Miscellaneous Provisions) Act 1968,Regulations relating to welfare of livestock10821,Agriculture (Miscellaneous Provisions) Act 1968,Powers of entry in connection with offences under this Act16855,Agriculture (Miscellaneous Provisions) Act 1972,Control of diseases carried by animals likely to affect humans14850,Agriculture (Poisonous Substances) Act 1952,Protection for agricultural workers against risk of poisoning8505,"Agriculture (Safety, Health & Welfare Provisions) Act 1956","Prohibit children from riding on or driving vehicles, machinery or implements used in agriculture"14848,Agricultural Wages Act 1948,Pertaining to rates of wages and holiday allowance15501,as amended by ,a) triable summarily only9999,,b) triable either way9979,Air Navigation Order 2005 ,Endangering safety of aircraft9980,Air Navigation Order 2005 ,Endangering safety of persons or property15515,Air Navigation Order 2005 ,Requirement to obey lawful commands of aircraft commander15516,Air Navigation Order 2005 ,Acting in disruptive manner9931,Air Navigation Order 2005 ,Unauthorised person acting as or purporting to be an air traffic controller or student air traffic controller15517,Air Navigation Order 2005 ,Air traffic controllers - summary offences9933,Air Navigation Order 2005 ,Air traffic controllers - TEW offences 15509,Air Navigation Order 2005 ,Summary offences15510,Air Navigation Order 2005; regulations made thereunder or provisions of JAR-145,Summary offences15511,Air Navigation Order 2005 ,Smoking in aircraft9943,Air Navigation Order 2005 ,Drunkenness in aircraft9944,Air Navigation Order 2005 ,TEW offences - except Article 759944,Air Navigation Order 2009 ,TEW offences 9979,Air Navigation Order 2009 ,Endangering safety of aircraft9980,Air Navigation Order 2009 ,Endangering safety of any person or property9943,Air Navigation Order 2009 ,Drunkenness in aircraft (includes drugs)15511,Air Navigation Order 2009 ,Smoking in aircraft15515,Air Navigation Order 2009 ,Requirement to obey authority of commander of an aircraft15516,Air Navigation Order 2009 ,Acting in a disruptive manner15509,Air Navigation Order 2009 ,Stowaway on an aircraft15510,Air Navigation Order 2009 ,Contravention of Rules of the Air regulations9931,Air Navigation Order 2009 ,Unauthorised person acting as or purporting to be an air traffic controller or student air traffic controller15517,Air Navigation Order 2009 ,Air traffic controllers - summary offences9933,Air Navigation Order 2009 ,Air traffic controllers - TEW offences 15518,Air Navigation Order 2009,"Exhibiting, directing or shining a light which by its glare or liability to be mistaken for an aeronautical ground light would endanger aircraft"15514,Air Navigation (Overseas Territories) Order 2001,Summary offences9970,Air Navigation (Overseas Territories) Order 2001      ,TEW offences - except Article 656670,Al-Qaida and Taliban (United Nations Measures) Order 2006,Contravening prohibition on disclosure of information6671,Al-Qaida and Taliban (United Nations Measures) Order 2006,Contravening prohibition on dealing with funds or economic resources6672,Al-Qaida and Taliban (United Nations Measures) Order 2006,Contravening prohibition on making available funds or economic resources6673,Al-Qaida and Taliban (United Nations Measures) Order 2006,Knowingly and intentionally participating in activities to circumvent an Article 7 or 8 prohibition6674,Al-Qaida and Taliban (United Nations Measures) Order 2006,Failure to comply with a condition attached to an Article 7 or 9 exemption licence12576,Al-Qaida and Taliban (United Nations Measures) Order 2006,Relevant institution failing to comply with requirement to provide information to the Treasury12577,Al-Qaida and Taliban (United Nations Measures) Order 2006,Refusing or failing to comply with any request to provide information to or produce document for Treasury6675,Al-Qaida and Taliban (United Nations Measures) Order 2006,Knowingly or recklessly giving any information or producing any document which is false in a material particular to Treasury12578,Al-Qaida and Taliban (United Nations Measures) Order 2006,Wilfully obstructing the Treasury in the exercise of their powers under Schedule 16676,Al-Qaida and Taliban (United Nations Measures) Order 2006,"With intent to evade provisions of Schedule 1 destroy, mutilate, deface, conceal or remove any document"6699,Al-Qaida and Taliban (Asset-Freezing) Regulations 2010,"Dealing with funds or economic resources belonging to, held or owned by a designated person"6699,Al-Qaida and Taliban (Asset-Freezing) Regulations 2010,"Making available directly or indirectly funds or economic resources belonging to, held or owned by a designated person"6699,Al-Qaida and Taliban (Asset-Freezing) Regulations 2010,Circumvent or enable or facilitate the contravention of a prohibition on the dealing with or availability of funds or economic resources6699,Al-Qaida and Taliban (Asset-Freezing) Regulations 2010,For the purpose of obtaining a Treasury licence providing false information or producing a document that was not what it purported to be or failing to comply with a condition on Treasury licence19599,Al-Qaida and Taliban (Asset-Freezing) Regulations 2010,Summary offences under Schedule 16699,Al-Qaida and Taliban (Asset-Freezing) Regulations 2010,TEW offences under Schedule 19901,Aliens Restriction (Amendment) Act 1919,Incitement to sedition by aliens among forces or civilians or promoting industrial unrest19599,Aliens Restriction (Amendment) Act 1919,Appointment of aliens to Civil Service14900,Allotments Act 1922,Causing damage to an allotment through negligence or any unlawful act9999,Ancient Monuments and Archaeological Areas Act 1979,Various offences5800,Ancient Monuments and Archaeological Areas Act 1979,Malicious damage10816,Animal and Animal Products (Import and Export) Regulations 1998 ,Summary offences under Regulation 31(a) & (b)9999,Animal and Animal Products (Import and Export) Regulations 1998 ,TEW offences10816,Animal and Animal Products (Import and Export) (No. 2) Regulations 2004 ,Summary offences  - Regulation 31(a) & (b)9996,Animal and Animal Products (Import and Export) (No. 2) Regulations 2004 ,TEW offences10816,Animal and Animal Products (Import and Export) (England) Regulations 2006                  ,Summary offences - 9996,Animal and Animal Products (Import and Export) (England) Regulations 2006                  ,TEW offences9169,Animal and Animal Products Regulations 1997,All offences made under these regulations10818,Animal Boarding Establishments Act 1963,Licensing and inspection of boarding establishment to ensure welfare of animals9183,Animal By-Products (Enforcement) (England) Regulations 2011,Triable either-way offences9183,Animal by-products (enforcement) (no2) (Wales) Regs 2011,"Failure to comply with animal by-product requirements or intentionally obstruct, fail to give information/ documentation/ facilities to an authorised person "9155,Animal By-Products (Identification) Regulations 1995,Triable either way offences9155,Animal By-Products Regulations 2005,TEW offences9155,Animal By-Products (Wales) Regulations 2006,Obstructing person acting in execution of the regulations11001,Animal Health Act 1981,"Summary offences against importation of animals, carcasses etc "9999,Animal Health Act 1981,Except RABIES11001,Animal Health Act 1981,Regulations to prevent the spreading of diseases among animals10812,Animal Health Act 1981,Cruelty to animals (offences against movement of animals)10812,Animal Health Act 1981,Prevention of suffering-transport of animals by sea and air19599,Animal Health Act 1981,Muzzling of dogs and the keeping of dogs under control and wearing by dogs in a public place of a collar with owner's name and address10812,Animal Health Act 1981,Provision of food and water at railway stations10812,Animal Health Act 1981,Cruelty to animals - restriction on export of animals generally10812,Animal Health Act 1981,Restriction and regulation of export of horses and ponies10812,Animal Health Act 1981,Restriction on export of registered ponies10812,Animal Health Act 1981,Cruelty to animals; master of ship to slaughter injured horses9999,Animal Health Act 1981,Regulations to prevent the spreading of rabies disease among animals10829,Animal Welfare Act 2006,"Causing, permitting or failing to prevent unnecessary suffering"10830,Animal Welfare Act 2006,"Carrying out, permitting or causing to be carried out or failing to prevent prohibited procedure on a protected animal"10831,Animal Welfare Act 2006,Removing or causing or permitting or failing to prevent removal of dogÕs tail other than for medical treatment10838,Animal Welfare Act 2006,Failing to certify working dog before it is 3 months old; show dog with a removed tail; knowingly give false information to a vet concerning giving of S.6 certificate10832,Animal Welfare Act 2006,Administration of poisons etc to a protected animal10833,Animal Welfare Act 2006,Offences relating to animal fights10834,Animal Welfare Act 2006,Failing to ensure needs of animal are met as required by good practice10835,Animal Welfare Act 2006,Selling animal to person under 1610836,Animal Welfare Act 2006,Carrying on activity without authority of S.13 licence or carrying on unregistered S.13 activity10839,Animal Welfare Act 2006,Intentionally obstructing person exercising power conferred by this section relating to animal in distress10837,Animal Welfare Act 2006,Breach of a disqualification imposed after conviction of specified offences10817,Animals (Cruel Poisons) Act 1962,Unlawful use of poison for destroying animals10801,Animals (Scientific Procedures) Act 1986,"a) SS.22(3), 23 and 25(3)"9999,Animals (Scientific Procedures) Act 1986,"b) SS.22(1), 22(2) and 24"16817,Anthrax Prevention Act 1919,Summary offences19352,Anti-Social Behaviour Act 2003,Remaining on or entering premises in contravention of a closure notice issued by a constable or other authorised person19349,Anti-Social Behaviour Act 2003,Obstructing a constable etc. acting under A.1(6)or 3(2) Ð serving closure Notice19350,Anti-Social Behaviour Act 2003,Remaining on premises in respect of which a closure notice has been made19351,Anti-Social Behaviour Act 2003,Entering premises in respect of which a closure notice has been made19688,Anti-Social Behaviour Act 2003,Remaining on or entering premises in contravention of Part 1A closure notice19689,Anti-Social Behaviour Act 2003,Obstructing a person acting under S.11A(7) or 11C(2019690,Anti-Social Behaviour Act 2003,Remaining on closed premises19691,Anti-Social Behaviour Act 2003,Entering closed premises19615,Anti-social Behaviour Act 2003,Contravention of a direction given by a constable under S.30(4) [dispersal of groups and removal of persons under 16 to their place of residence]19616,Anti-social Behaviour Act 2003,Without reasonable excuse permitting premises to be open in contravention of closure order13819,Anti-Social Behaviour Act 2003,Failure to give name and address or giving false or inaccurate name or address when required to do so19617,Anti-social Behaviour Act 2003,Selling aerosol paint container to a person under 16 years19624,Anti-social Behaviour Act 2003,Intentionally obstructing a person acting in the exercise of the powers of entry for the purpose of complaints and appeals19624,Anti-social Behaviour Act 2003,Obstruction of person acting in the exercise of his powers under Section 7419619,Anti-social Behaviour Act 2003,Action not taken in accordance with remedial notice19620,Anti-social Behaviour Act 2003,Continuing failure to comply with remedial notice19621,Anti-social Behaviour Act 2003,Continuing failure to comply with remedial order after conviction under Section 75(9)19622,Anti-social Behaviour Act 2003,Wilful obstruction of a person acting in the exercise of powers under S.77 to enter land & take action9502,"Anti-Terrorism, Crime and Security Act 2001",Obstruction of officer in exercise of power conferred by a warrant or failure without reasonable excuse to comply with a request made by an authorised officer or constable9503,"Anti-Terrorism, Crime and Security Act 2001",Knowingly making false or misleading statements for purpose of obtaining or opposing the variation or withdrawal of authorisation for the purposes of SS.47 & 509504,"Anti-Terrorism, Crime and Security Act 2001",Occupier failing without reasonable excuse to comply with any duty or direction imposed on him by or under this Part (7); knowingly or recklessly making a statement which is false or misleading9972,"Anti-Terrorism, Crime and Security Act 2001",TEW offences made under this section12562,"Anti-Terrorism, Crime and Security Act 2001",Summary Regulations made under this section6611,"Anti-Terrorism, Crime and Security Act 2001",Prohibition of disclosures relating to nuclear security6612,"Anti-Terrorism, Crime and Security Act 2001",Prohibition of disclosures of uranium enrichment technology524,"Anti-Terrorism, Crime and Security Act 2001",Use of noxious substances or things to cause harm and intimidate6615,"Anti-Terrorism, Crime and Security Act 2001",Hoaxes involving noxious substances or things9505,"Anti-Terrorism, Crime and Security Act 2001 ",Failure to comply with prohibition imposed by order; engaging in an activity knowing or intending that it will enable or facilitate the commission by another person of an offence under a provision included under para.212575,"Anti-terrorism, Crime and Security Act 2001","Failure to provide information, produce documentation etc"19599,Architects Registration Act 1938,"Use of title ""Architect"" and factors relating to registration"15302,as amended by ,a) triable summarily only9999,,b) triable either way9999,Armed Forces Act 2006,Aiding or abetting etc desertion or absence without leave9999,Armed Forces Act 2006,Aiding or abetting etc malingering15302,Armed Forces Act 2006,Obstructing person subject to service law in course of duty11003,Artificial Insemination of Cattle (Emergency Licences) (Wales) Regulations 2001,Offence against S.10(6) Animal Health and Welfare Act 1984 (foot and mouth Disease)10430,Assaults Ð Provisions in Local Acts,On constable7822,Asylum and Immigration Act 1996 ,Employing a person subject to immigration control who has attained the age of 16 (was 194/35)7817,Asylum and Immigration (Treatment of Claimants) Act 2004,Being unable to produce an immigration document at a leave or asylum interview in respect of himself7818,Asylum and Immigration (Treatment of Claimants) Act 2004,Being unable to produce an immigration document at a leave or asylum interview in respect of a dependent child7819,Asylum and Immigration (Treatment of Claimants) Act 2004,Trafficking people into the UK for the purpose of exploitation7820,Asylum and Immigration (Treatment of Claimants) Act 2004,Trafficking people within the UK for the purpose of exploitation7821,Asylum and Immigration (Treatment of Claimants) Act 2004,Trafficking people out of the UK7823,Asylum and Immigration (Treatment of Claimants) Act 2004,Failure to comply with a requirement to take specified action as the Secretary of State required15305,Atomic Weapons Establishment (AWE) Aldermaston Byelaws 2007.,Offences carried out in the Protected areas of AWE Aldermaston15305,Atomic Weapons Establishment (AWE) Burghfield Byelaws 2010,Offences carried out in the Protected areas of AWE Burghfield19599,Attachment of Earnings Act 1971,Attachment of earnings as a means of enforcing the discharge of monetary obligations9856,Attachment of Earnings Act 1971,Disclosing debtor information without authority[Proceedings cannot be instituted except by or with consent of Attorney General]"[Proceedings cannot be instituted except by or with consent of Attorney General]"[Proceedings cannot be instituted except by or with consent of Attorney General]"[Proceedings cannot be instituted except by or with consent of Attorney General]"[Proceedings cannot be instituted except by or with consent of Attorney General]"[Proceedings cannot be instituted except by or with consent of Attorney General]"9526,Aviation and Maritime Security Act 1990,Failing to provide information or making false statement relating to ship or harbour area9804,Aviation and Maritime Security Act 1990,TEW offences19636,Aviation and Maritime Security Act 1990,Summary offences9812,Aviation Security Act 1982,Offences in relation to certain dangerous articles9999,Aviation Security Act 1982,Relating to the exercise of powers9823,Aviation Security Act 1982,Failure to comply with Section 18A enforcement notice 9824,Aviation Security Act 1982,Interference with buildings constructed or work executed or anything installed on or over land under S.18A notice9973,Aviation Security Act 1982,Regulations may create a criminal offence - direction under SS.12 - 149974,Aviation Security Act 1982,Failure to comply with a requirement of a detention direction; intentionally obstructing a person acting in accordance with ss.(3) (authorised person ensuring aircraft does not fly)19587,Aviation Security Act 1982,With intent to deceive issuing a document purporting to be issued by a person on a list of approved air cargo agents maintained under S.21F(2)(a)8301,Bail Act 1976,Failing to surrender to bail8302,Bail Act 1976,Indemnifying surety for bail9999,Banking Act 1987,Fraudulent inducement to make a deposit19599,Bees Act 1980,Bees - health and welfare11603,Behring Sea Award Act 1894,Offences against fishery laws9924,Betting and Gaming Duties Act 1981,Prohibitions for the protection of revenue17200,Betting and Gaming Duties Act 1981,Summary offences19599,Births and Deaths Registration Act 1953,Failing to register births and deaths7825,"Borders, Citizenship and Immigration Act 2009","Wrongful disclosure of information in breach of SS.15(1), 15(2) or 17(1)"9999,Bovines and Bovine Products (Trade) Regulations 1999,Offences against regulations11002,Bovine Spongiform Encephalopathy (BSE) (Feeding Stuffs and Surveillance) Regulations 1999,"Intentionally or recklessly defacing, obliterating or removing any mark; intentionally or recklessly contravening Reg.4(2)"11002,Bovine Spongiform Encephalopathy (BSE) (Feeding Stuffs and Surveillance) Regulations 1999,"Obstructing, failing to furnish information or assistance; furnishing false or misleading information - contravening Reg. 5(1)"11122,Breeding and Sale of Dogs (Welfare) Act 1999,Sale of dogs11123,Breeding and Sale of Dogs (Welfare) Act 1999,Having custody of dog in contravention of S.9(2)(c) and failure to comply with S.9(5)11107,Breeding of Dogs Act 1973,Licensing of breeding establishments for dogs11108,Breeding of Dogs Act 1991,Intentionally obstructing or delaying any person in the exercise of his powers of entry or inspection under S.1 9907,Bribery Act 2010,"Offences relating to offering, promising or giving bribes "9908,Bribery Act 2010,"Offences relating to requesting, agreeing to receive and accepting bribes "9909,Bribery Act 2010,Bribery of foreign public officials9910,Bribery Act 2010,Commercial organisation - failure to prevent associate bribing another with intent to obtain or retain business or advantage19599,British Mercantile Marine Uniform Act 1919,Improper use of British Mercantile Marine uniform19599,British Nationality Act 1981,Relates to the status of a British subject derived by virtue of citizenship16906,British Railways Board Byelaws ,Railway byelaws as to the conduct of passengers9999,British Fishing Boats Act 1983,"Restrictions on fishing, etc by British fishing boats"9999,British Fishing Boats Act 1983,Failing to comply with requirements; assaulting any officer exercising powers under SS.2 or 316920,British Transport Commission Act 1949,"Trespass, throwing stones                          *PENALTY OFFENCE under S.1 Criminal Justice & Police Act 2001"19599,British Transport Commission Act 1962,Impersonating Constable19599,British Waterways Act 1971,Private Act9999,Broadcasting Act 1990,Prohibition on providing independent radio services without a licence9962,Bovine Spongiform Encephalopathy (BSE) Regulations,TEW offences11002,Bovine Spongiform Encephalopathy (BSE) Regulations,Summary offences9962,Bovine Spongiform Encephalopathy Monitoring (BSE) (England) Regulations 2001,Offences made under these regulations16825,Building Act 1984,Contravention of condition of exemption16807,Building Act 1984,Contravention of condition of type relaxation of building regulations16825,Building Act 1984,Use of short-lived materials16825,Building Act 1984,Facilities for refuse16825,Building Act 1984,Provision of water supply - unlawful occupancy16825,Building Act 1984,Breach of regulations16807,Building Act 1984,Cancellation of initial notice9999,Building Act 1984,Making false or misleading statement16825,Building Act 1984,Repair etc. of drain16807,Building Act 1984,Disconnection of drain16807,Building Act 1984,Construction/repair of w.c./drain16825,Building Act 1984,Erection of public conveniences19599,Building Act 1984,"Entrances, exits etc. to be required in certain cases"16825,Building Act 1984,Failure to comply with notice - means of escape from fire16807,Building Act 1984,Failure to comply with notice - raising of chimney16807,Building Act 1984,Cellars and rooms below subsoil water level16825,Building Act 1984,Failure to comply with notices - dangerous building16807,Building Act 1984,"Failure to notify intended demolition, disconnection etc"16825,Building Act 1984,Maintenance of entrances to courtyards16825,Building Act 1984,Disclosure of information16825,Building Act 1984,Failure to execute works required by notice16825,Building Act 1984,Obstruction19599,Burial Act 1857,Removing corpse from grave19599,Business Names Act 1985,All offences - ( subsequent offences)9999,Business Protection from Misleading Marketing Regulations 2008,Engaging in advertising which is misleading under R.319599,Business Protection from Misleading Marketing Regulations 2008,Intentionally obstructing officer of enforcement authority acting in pursuance of the regulations19599,Business Protection from Misleading Marketing Regulations 2008,Intentionally failing to comply with requirement properly made by officer under R.2319599,Business Protection from Misleading Marketing Regulations 2008,Without reasonable cause failing to give officer assistance or information9999,Business Protection from Misleading Marketing Regulations 2008,Knowingly make false statement giving information under R.25(1)(c )19599,Cancellation of Contracts made in a Consumer's Home or Place of Work etc. Regulations 2008         ,Trader entering into a contract failing to give notice of right to cancel16831,Cancer Act 1939 ,Prohibition of certain advertisements