8103,Firearms Act 1968 as amended by Criminal Justice and Public Order Act 1994,Possessing etc firearm or ammunition without firearm certificate                                                                     (Group 1)11504,Firearms Act 1968,Non-compliance with condition of firearm certificate8104,Firearms Act 1968,Possessing etc shot gun without certificate                         (Group 1)11506,Firearms Act 1968,Non-compliance with condition of shotgun certificate                                                                      (Group II)8107,Firearms Act 1968,Trading in firearms without being registered                         (Group I)8108,Firearms Act 1968,Trading in firearms without being registered           (Group II)8109,Firearms Act 1968,Selling firearm(s) to person without certificate                     (Group 1)8110,Firearms Act 1968,Selling firearm(s) to person without certificate                         (Group II)8176,Firearms Act 1968,Selling or transferring an air weapon unlawfully8111,Firearms Act 1968,"Repairing, testing etc firearm without certificate(Group 1)"8112,Firearms Act 1968,"Repairing, testing etc firearm without certificate                 (Group II)"8113,Firearms Act 1968,Falsifying certificate etc with a view to acquiring firearm                                                                                      (Group 1)8114,Firearms Act 1968,"Falsifying certificate etc with a view to acquiring firearm(Group II)"15706,Firearms Act 1968,"Taking firearms or ammunition in pawn(Group I)"15707,Firearms Act 1968,"Pawnbroker taking shotgun in pawn(Group II)"8115,Firearms Act 1968,Shortening shot gun or other smooth bore gun 8116,Firearms Act 1968,Conversion of firearms(Group 1)"8170,Firearms Act 1968,"Possessing or distributing prohibited weapons designed for discharge of noxious liquid etc.(Group I)"(Group I)"11518,Firearms Act 1968,"Failure of an individual to comply with any condition of an authority vested in him(Group I)"11519,Firearms Act 1968,"Non-compliance to surrender an authority(Group I)"11520,Firearms Act 1968,Restricting removal of firearms                                           (Group I)11521,Firearms Act 1968,Making false statement to obtain permit                                   (Group I)11522,Firearms Act 1968 ,Making false statement to obtain permit                                (Group II)11592,Firearms Act 1968,"Making false statement to obtain permit to auction firearms etc(Group I)"11593,Firearms Act 1968,"Making false statement to obtain permit to auction firearms etc(Group II)"11525,Firearms Act 1968,"Making false statement to obtain permit for removal of signalling apparatus(Group I)"(Group I)"(Group II)"(Group III)"(Group I)"(Group II)"(Group III)"(Group 1)"(Group II)"(Group III)"(Group I)"(Group II)"(Group III)"(Group I)"(Group II)"(Group III)"8126,Firearms Act 1968,"Carrying loaded or unloaded firearm and ammunition in public place etc. [any other firearm (not imitation firearm or an air weapon or loaded shotgun) (whether loaded or not) together with ammunition suitable for use in that firearm](Group I)"8127,Firearms Act 1968,Carrying loaded or unloaded firearm in public place etc. [loaded shot gun (not imitation firearm or an air weapon)]                                                                         (Group II)8177,Firearms Act 1968,"Carrying a loaded or unloaded or imitation firearm or air weapon in public place (was 115/28)(Group III)"8129,Firearms Act 1968,"Trespassing with firearm or imitation firearm in a building(Group I)"8130,Firearms Act 1968,"Trespassing with firearm or imitation firearm in a building(Group II)"11531,Firearms Act 1968,"Trespassing with firearm in a building(Group III)"11532,Firearms Act 1968,"Trespassing with firearm on land(Group I)"11533,Firearms Act 1968,"Trespassing with firearm on land(Group II)"11534,Firearms Act 1968,"Trespassing with firearm on land(Group III)"19669,Firearms Act 1968,Fire an air weapon beyond premises8135,Firearms Act 1968,"Possession of firearms by persons previously convicted of crime(Group I)"8136,Firearms Act 1968,"Possession of firearms by persons previously convicted of crime(Group II)"8137,Firearms Act 1968,"Possession of firearms by persons previously convicted of crime(Group III)"8138,Firearms Act 1968,"Supplying firearms to person denied them under Section 21(Group I)"8139,Firearms Act 1968,"Supplying firearms to person denied them under Section 21(Group II)"8140,Firearms Act 1968,"Supplying firearms to person denied them under Section 21(Group III)"11541,Firearms Act 1968,"Person under 17 purchasing or hiring firearm or ammunition(Group I)"11542,Firearms Act 1968,"Person under 17 purchasing or hiring firearm or ammunition(Group II)"11543,Firearms Act 1968,"Person under 18 purchasing or hiring firearm or ammunition(Group III)"11544,Firearms Act 1968,"Person under 14 having firearm or ammunition in his possession(Group I)"11545,Firearms Act 1968,"Person under 15 having with him a shotgun without adult supervision(Group II)"11546,Firearms Act 1968,"Person under 17 having with him an air weapon or ammunition(Group III)"11548,Firearms Act 1968,"Person under 17 making improper use of air weapon when under supervision(Group III)"11549,Firearms Act 1968,"Person supervising permitting improper use of air weapon by person under 17(Group III)"11550,Firearms Act 1968,"Selling or letting on hire a firearm or ammunition to person under 17(Group I)"11551,Firearms Act 1968,"Selling or letting on hire a firearm or ammunition to person under 17(Group lI)"11552,Firearms Act 1968,"Selling or letting on hire a firearm or ammunition to person under 18(Group III)"11553,Firearms Act 1968,"Making a gift or lending any firearm or ammunition to person under 14(Group I)"11554,Firearms Act 1968,"Making gift of shotgun to person under 15(Group II)"11555,Firearms Act 1968,"Supplying air weapon to person under 17(Group III)"19672,Firearms Act 1968,Person under 18 purchasing an imitation firearm; selling an imitation firearm to person under 1811556,Firearms Act 1968,"Supplying firearm to person drunk or insane(Group I)"11557,Firearms Act 1968,"Supplying firearm to person drunk or insane(Group II)"11558,Firearms Act 1968,"Supplying firearm to person drunk or insane(Group III)"11559,Firearms Act 1968,"Making false statement to obtain grant or renewal of firearm certificate(Group I)"11560,Firearms Act 1968,"Making false statement to obtain grant or renewal of shot gun certificate(Group II)"11561,Firearms Act 1968,"Making false statement to procure variation of a firearm certificate(Group I)"11562,Firearms Act 1968,"Failing to surrender firearm certificate or firearm or ammunition on revocation of certificate(Group I)"11563,Firearms Act 1968,"Failing to surrender shotgun certificate or shotgun or ammunition on revocation of certificate(Group II)"11565,Firearms Act 1968,Making false statement to secure registration of a place of business11566,Firearms Act 1968,Registered dealer failing to have place of business entered in register11567,Firearms Act 1968,Non-compliance with condition of registration11568,Firearms Act 1968,Non-compliance by dealer as to register of transactions-false entry11588,Firearms Act 1968,Failing to report a transaction authorised by a visitor's shotgun permit11569,Firearms Act 1968,Obstructing constable or civilian in exercise of search powers11570,Firearms Act 1968,Failure to surrender firearm or ammunition on demand by constable                                                       (Group I)11571,Firearms Act 1968,Failure to surrender firearm or ammunition on demand by constable                                                                            (Group II)11572,Firearms Act 1968,Failure to surrender firearm or ammunition on demand by constable                                                           (Group III)11573,Firearms Act 1968,Failure to comply with requirements of a constable to declare name and address                                             (Group I)11574,Firearms Act 1968,Failure to comply with requirements of a constable to declare name and address                                             (Group II)11575,Firearms Act 1968,Failure to give constable facilities for examination of firearms in transit                                                            (Group I)11576,Firearms Act 1968,Failure to surrender firearm certificate                                                                            (Group I)11577,Firearms Act 1968,Failure to surrender shotgun certificate                                                                  (Group II)11578,Firearms (Amendment) Act 1988,Transfers of shotguns                                                                                                                      (Group II)11579,Firearms (Amendment) Act 1988,Restriction on sale of ammunition for smooth-bore guns                                                                             (Group II)11580,Firearms (Amendment) Act 1988,"Auctioneer, carrier or warehouseman failing to keep firearms and ammunition safe or failing to report loss or theft                                                                     (Group I)"11581,Firearms (Amendment) Act 1988,"Auctioneer, carrier or warehouseman failing to keep firearms and ammunition safe or failing to report loss or theft                                                                     (Group II)"11590,Firearms (Amendment) Act 1988,Obstructing a constable entering or inspecting an approved rifle/ pistol club11582,Firearms (Amendment) Act 1988,Making false statement to obtain a visitor's permit           (Group I)11583,Firearms (Amendment) Act 1988,Failing to comply with conditions on a visitor's permit                                                                                 (Group I)11584,Firearms (Amendment) Act 1988,Making false statement to obtain a visitor's permit                         (Group II)11585,Firearms (Amendment) Act 1988,Failing to comply with conditions on a visitor's permit                                                                             (Group II)11586,Firearms (Amendment) Act 1988,Firearms dealer failing to inform police of sale of firearms for export                                                                  (Group I)11587,Firearms (Amendment) Act 1988,Firearms dealer failing to inform police of sale of firearms for export                                                             (Group II)11591,Firearms (Amendment) Act 1988,"Making a false statement to obtain, or not complying with, museum licence "11591,Firearms (Amendment) Act 1988,Failing to comply with condition of museum licence 11591,Firearms (Amendment) Act 1988,Failing to surrender a revoked museum licence8142,Firearms (Amendment) Act 1997,Failure to transfer firearms or ammunition in person     (Group I)8169,Firearms Amendment Act 1997,Failing to comply with instruction in firearm certificate upon transfer to person other than registered dealer                                                   (Group I)8143,Firearms (Amendment) Act 1997,Failure to give notice in writing to Chief Officer of Police of transfers involving firearms                                                (Group I)8144,Firearms (Amendment) Act 1997,"Failure by certificate holder to notify in writing Chief Officer of Police of deactivation, destruction or loss of firearms or ammunition                                 (Group I)"8145,Firearms (Amendment) Act 1997,"Failure by certificate holder to notify in writing Chief Officer of Police of events taking place outside Great Britain involving firearms and ammunition (sold or otherwise disposed of, lost etc.)                       (Group I)"11594,Firearms (Amendment) Act 1997,Failure to transfer shotgun in person                                                            (Group II)11598,Firearms Amendment Act 1997,Failing to comply with instruction in shotgun certificate upon transfer to person other than registered dealer                                                                                  (Group II)11595,Firearms (Amendment) Act 1997,Failure to give notice in writing to the Chief Officer of Police of transfers involving shotguns                             (Group II)11596,Firearms (Amendment) Act 1997,"Failure by certificate holder to give written notice to the Chief Officer of Police of deactivation, destruction or loss of shotgun                                                          (Group II)"11597,Firearms (Amendment) Act 1997,"Failure by certificate holder to notify in writing to the Chief Officer of Police of events taking place outside Great Britain involving shotguns (sold or otherwise disposed of, lost etc.)                                (Group II)"19599,Fire Precautions Act 1971,Failure to keep a fire certificate in the relevant premises9999,Fire Precautions Act 1971,Failure to have a fire certificate9999,Fire Precautions Act 1971,Contravention of any requirement of fire certificate9999,Fire Precautions Act 1971,Failure to notify fire authority of any structural alterations of premises of storage of flammable material or explosives9999,Fire Precautions Act 1971,Storing explosives or highly flammable materials without a fire certificate to cover this9999,Fire Precautions Act 1971,Contravening fire authority's direction for material extension or structural alteration or storing volatile material19599,Fire Precautions Act 1971,Failing to provide means of escape and for fighting fire9999,Fire Precautions Act 1971,Contravening requirements imposed by an improvement notice9999,Fire Precautions Act 1971,Contravention of prohibition notice9999,Fire Precautions Act 1971,Contravening fire precaution regulations9999,Fire Safety and Safety of Places of Sport Act 1987,Contravening term or condition of a safety certificate for a regulated stand at sports ground16830,Fire Services Act 1947,"Misuse of fire hydrant, damaging or obstructing fire hydrant"16830,Fire Services Act 1947,Obstructing firemen in extinguishing fires16407,Fire Services Act 1947,False alarms of fire                                                      *PENALTY OFFENCE under S.1 Criminal Justice & Police Act 200111300,Fireworks Act 1951,Restrictions relating to the manufacturing of fireworks19602,Fireworks Act 2003,Failure to comply with requirement imposed in or under Fireworks Regulations to give or not to give information13809,Fireworks Act 2003,Knowingly or recklessly making a statement which is false in a material particular when a requirement to give information is imposed by or under fireworks regulations19601,Fireworks Regulations 2004,Contravening a prohibition imposed by Fireworks Regulations16847,Fireworks (Safety) Regulations 1997,Contravention of Regulations - offences under S.12 Consumer Protection Act 198711617,Fisheries Act 1981,"Sea Fish industry - failure to keep records or to produce on demand, or obstructing an officer"11617,Fisheries Act 1981,Altering a record or furnishing false information9999,Fisheries Act 1981,Restriction on disclosure of information11617,Fisheries Act 1981,Offences in connection with schemes9999,Fishery Limits Act 1976,Contravention of order regulating access to British fisheries19599,Food Act 1984,Prohibited sales in market hours9166,Food Hygiene (England) Regulations 2006                ,TEW offences13821,Food Hygiene (England) Regulations 2006                ,Obstruction of Officers etc.9166,Food Hygiene (Wales) Regulations 2006                ,TEW offences13821,Food Hygiene (Wales) Regulations 2006                ,Obstruction of Officers etc.16829,Food Safety Act 1990,Public Health offences triable summarily (except S.33(1) [see 101/07] and Regulations made under this Act)8901,Food Safety Act 1990 and Regulations and Orders made under this Act,General protection of the public against injurious food or drugs8904,Food Safety Act 1990,Rendering food injurious to health9101,"Food Safety Act 1990 and Regulations & Orders made under SS.6(4), 13(1) & 48(1)",Public Health Offences as related to food and drugs8905,Food Safety Act 1990,Selling food not complying with food safety requirements8906,Food Safety Act 1990,Selling food not of the nature or substance or quality demanded8907,Food Safety Act 1990,Falsely describing or presenting food10107,Food Safety Act 1990,Obstruction etc. of officers; failing to give information8908,Food Safety Act 1990,Obstruction etc. of officers; furnishing false information9102,Food Safety Act (General Food Hygiene) Regulations 1995,"Hygiene offences in connection with sale, etc. of food to the public"9967,Foot and Mouth Disease Regulations,TEW offences11003,Foot and Mouth Disease Regulations,Summary offences9172,Foot and Mouth Disease (Export Restrictions) (England) Regulations 2007,Contravening regulations12527,Football Offences Act 1991,Throwing a missile at or towards the playing area or any area in which spectators or other persons may be present12528,Football Offences Act 1991,Taking part in indecent or racist chanting12529,Football Offences Act 1991,Going onto the playing or adjacent area without lawful authority or lawful excuse6605,Football Spectators Act 1989,"Admitting spectators to, or allowing spectators to remain on, unlicensed premises"12523,Football Spectators Act 1989,Contravening a licence12559,Football Spectators Act 1989,Failure to comply with requirements of Football Banning Order12524,Football Spectators Act 1989,Failing to comply with the duty to report imposed by a restriction order 12525,Football Spectators Act 1989,Failing to comply with requirements necessary to give effect to restriction orders12526,Football Spectators Act 1989,Making a false statement or making use of a false document in connection with an application for exemption from the duty to report12560,Football Spectators Act 1989,Failure to comply with notice given under S.21B12109,Forestry Act 1967 ,Game laws - obstructing person authorised to kill rabbits or vermin15607,Forestry Act 1967 except S.7(4) ,"Parks, commons and open spaces offences"6021,Forgery and Counterfeiting Act 1981 ,Forgery etc of prescription in respect of scheduled drug6121,Forgery and Counterfeiting Act 1981,Other forgery or copying false instrument6022,Forgery and Counterfeiting Act 1981,Using a false instrument etc in respect of scheduled drug6122,Forgery and Counterfeiting Act 1981,Using a false instrument or a copy of a false instrument6123,Forgery and Counterfeiting Act 1981,Possess false instrument or materials to make false instrument6124,Forgery and Counterfeiting Act 1981,Making counterfeit coin or note6125,Forgery and Counterfeiting Act 1981,Passing etc counterfeit coin or note as genuine6126,Forgery and Counterfeiting Act 1981,Possessing counterfeit coin or note6127,Forgery and Counterfeiting Act 1981,Possessing materials or dyes to make counterfeit coin or note6128,Forgery and Counterfeiting Act 1981,Reproducing British currency note or making imitation British coins5340,Fraud Act 2006,Dishonestly making a false representation to make a gain for oneself or another or to cause loss to another or to expose another to a risk5341,Fraud Act 2006,Dishonestly failing to disclose information to make a gain for oneself or another or to cause loss to another or to expose another to a risk 5342,Fraud Act 2006,Committing fraud by dishonestly abusing oneÕs position5343,Fraud Act 2006,Possession etc. of articles for use in frauds5344,Fraud Act 2006,"Making, adapting, supplying or offering to supply any article knowing that it is designed or adapted for use in the course of or in connection with fraud, or intending it to be used to commit or facilitate fraud"5345,Fraud Act 2006,Participating in fraudulent business carried on by sole trader5346,Fraud Act 2006,"By any dishonest act obtaining services for which payment is required, with intent to avoid payment; includes Ôattaching a decoder to her television to enable viewing access to cable or satellite television channels for which she has no intention of payingÕ"5305,Fraudulent Mediums Act 1951,Purporting to act as a spiritualistic medium for reward15903,Freedom of Information Act 2000,Altering etc. records with intent to prevent disclosure8911,Fresh Meat (Hygiene and Inspection) Regulations 1995    ,All TEW offences under these Regulations11700,Friendly Societies Acts 1896 to 1992,Summary offences10827,Fur Farming (Prohibition) Act 2000,"Keeping or knowingly allowing to keep animals for slaughter for the value of their fur, or breeding progeny for such slaughter"10828,Fur Farming (Prohibition) Act 2000,Intentionally obstructing or delaying a person in the exercise of his powers under S.4(1)19654,Furniture and Furnishings (Fire) (Safety) Regulations 1988,"Supplying, offering or agreeing or exposing or possessing to supply furniture which did not satisfy Schedule 1 of the Regulations"10646,Gambling Act 2005,Provision of facilities for gambling unless authorised by an operating licence or covered by a specific exception10647,Gambling Act 2005,Use of premises for gambling without a licence10648,Gambling Act 2005,"Gambling software Ð manufacture, supply, install or adapt, in the course of a business, computer software for remote gambling without an operating licence"7539,Gambling Act 2005,Cheating at gambling or enabling or assisting person to cheat10649,Gambling Act 2005,"Inviting another to join, or participating in promotion, administration or management of a chain-gift scheme"10650,Gambling Act 2005,Inviting children and young persons to gamble; participation by young persons in gambling            Penalty if adult (18+) commits offences10650,Gambling Act 2005,Inviting children and young persons to gamble; participation by young persons in gambling.                 Penalty if young person (16-17) commits offences10650,Gambling Act 2005,Invitation to enter premises; young person entering premises (children and young persons may not enter gambling premises).                                 Penalty if adult (18+) commits offences10651,Gambling Act 2005,Invitation to enter premises; young person entering premises (children and young persons may not enter gambling premises).                                        Penalty if young person (16-17) commits offences10652,Gambling Act 2005,Provision of facilities for gambling - young person providing facilities for gambling                               Penalty if young person (16-17) commits offence10653,Gambling Act 2005,Employment offences: offence to employ children and young persons                                                         Penalty if adult (18+) commits offences10653,Gambling Act 2005,Employment offences: offence to employ children and young persons                                                          Penalty if young person (16-17) commits offences10654,Gambling Act 2005,"Invitation to participate in lottery: offence to invite, cause or permit a child to take part in a lottery                                                          Penalty if adult (18+) commits offences"10654,Gambling Act 2005,"Invitation to participate in lottery: offence to invite, cause or permit a child to take part in a lottery                               Penalty if young person (16-17) commits offences"10655,Gambling Act 2005,"Invitation to participate in football pools: offence to invite, cause or permit a child to take part in football pools                                                                               Penalty if adult (18+) commits offences"10655,Gambling Act 2005,"Invitation to participate in football pools: offence to invite, cause or permit a child to take part in football pools                                                                                 Penalty if young person (16-17) commits offences"10656,Gambling Act 2005,Failure to return stake money to children or young persons                                                                          Penalty if adult (18+) commits offences10656,Gambling Act 2005,Failure to return stake money to children or young persons                                                                          Penalty if young person (16-17) commits offences10657,Gambling Act 2005,"S of S to create offence of inviting, causing or permitting a child or young person below a specified age to use a Category D gaming machine                                          Penalty if adult (18+) commits offences"10657,Gambling Act 2005,"S of S to create offence of inviting, causing or permitting a child or young person below a specified age to use a Category D gaming machine                                                                   Penalty if young person (16-17) commits offences"10658,Gambling Act 2005 ,Operating licence offences: production of licence; conviction; information10659,Gambling Act 2005,Breach of personal licence condition (Use with proceedings code 68)10660,Gambling Act 2005,"Gaming machines: making machine available for use; manufacture, supply etc, linked machines"10662,Gambling Act 2005,Promotion of lottery; facilitating a lottery10666,Gambling Act 2005,Misusing profits of lottery or exempt lottery10667,Gambling Act 2005,Small lottery: breach of conditions (Use with proceedings code 69)10668,Gambling Act 2005,Misusing profits of non-commercial prize gaming10669,Gambling Act 2005 ,All regulations controlling the advertising of gambling10670,Gambling Act 2005 ,Advertising unlawful gambling10671,Gambling Act 2005 ,Advertising foreign gambling other than a lottery