16908,Railways and Transport Safety Act 2003,Summary Offences9515,Railways and Transport Safety Act 2003 ,Failure to comply with a direction given by Chief Inspector of Rail Accidents9988,Railways and Transport Safety Act 2003,"All TEW offences except SS.10, 78-82 and 92-95"713,Railways and Transport Safety Act 2003 ,"Ability of Master, Pilot or Seaman to carry out his duties being impaired because of drink or drugs"525,Railways and Transport Safety Act 2003 ,Performing an aviation function or ancillary function when ability to carry out function is impaired because of drink or drugs19550,Refuse Disposal (Amenity) Act 1978 ,Dumping13818,Refuse Disposal (Amenity) Act 1978 ,Failure to give name and address or giving false or inaccurate name or address when required to do so19599,Regional Development Agencies Act 1998,Intentionally obstructing person acting in exercise of powers under Section 21 (right of entry)9999,Regional Development Agencies Act 1998,Disclosure of information (trade secret or manufacturing process) by person admitted to factory etc. under s.2116825,Registered Homes Act 1984 ,Registration of residential care home and conduct9999,Registered Homes Act 1984,Failure to register nursing home or mental nursing home19599,Registration of Political Parties Act 1998,Knowingly or recklessly makes false statement to registrar9956,Regulation of Investigatory Powers Act 2000,Unlawful interception of a postal public or private telecommunication scheme9957,Regulation of Investigatory Powers Act 2000,Fail to give effect to an interception warrant9958,Regulation of Investigatory Powers Act 2000,Unlawful disclosure of details of interception warrant9959,Regulation of Investigatory Powers Act 2000,Fail to disclose key to protected information9960,Regulation of Investigatory Powers Act 2000,Disclose details of Sec 49 Notice16901,Regulation of Railways Act 1868,"Failing to show ticket, pay fare or give name and address"16901,Regulation of Railways Act 1868,Travelling without paying fare16901,Regulation of Railways Act 1868,Travelling beyond distance for which fare paid16901,Regulation of Railways Act 1868,Giving false name and address16901,Regulation of Railways Act 1868,Trespassing on railway8507,Regulatory Reform (Fire Safety) Order 2005,TEW offences11001,Rendering (Fluid Treatment) (England) Order 2001,"Contravention etc. of AA.3,4,5,6(2),7(2)"19599,Rent Act 1977 ,Recovery from landlord of sums paid in excess of recoverable rent etc19599,Rent Act 1977 ,Effect of registration of rent19599,Rent Act 1977 ,Prohibition of premiums and loans on assignment of protected tenancies19599,Rent Act 1977 ,Prohibition of premiums on grant or assignment of rights under restricted contracts19599,Representation of the People Act 1983 and Representation of the People Regulations 1986 ,Failing to comply with information notice as to household voters9906,Representation of the People Act 1983,Personation19599,Representation of the People Act 1983,Other voting offences19599,Representation of the People Act 1983,Offences in connection with service and patient's declarations9999,Representation of the People Act 1983,"Tampering with nomination papers, ballot papers etc"9905,Representation of the People Act 1983,Bribery at election9905,Representation of the People Act 1983,Treating at election9905,Representation of the People Act 1983,Undue influence9999,Representation of the People Acts 1983 - 2000,TEW offences not included in 99/05 & 99/0619599,,Summary offences15315,Reserve Forces Acts 1980 and 1996,So far as concerns soldiers15404,Reserve Forces Acts 1980 and 1996,So far as concerns the naval and marine forces15508,Reserve Forces Acts 1980 and 1996,So far as concerns airmen10440,"Resisting or obstructing constables; offences against provisions in Local Acts (other than 104/31, 33 & 34)",Resisting or obstructing constables in execution of duty19520,Restriction of Offensive Weapons Act 1959,Relating to offences in connection with dangerous weapons16824,Restriction of Ribbon Development Act 1935,"Power to require the provisions of means of entrance and egress etc, as a condition of approval of building plans"9999,Restrictive Trade Practices Act 1976,Offences in connection with registration17200,Revenue Laws  (other offences against),Summary offences8202,,Triable either way10819,Riding Establishments Acts 1964 and 1970,"Cruelty to animals:- offences of cruelty, ill treatment, neglect etc of animals including offences in relation to use, confinement or conveyance of animals, vivisection, prohibited sports and pastimes, irregularities in horse slaughtering etc"16904,Road and Rail Traffic Act 1933,Non-compliance with Minister's direction that level crossing gates be kept closed across the railway at certain times82514,"Road Safety (Immobilisation, Removal and Disposal of Vehicles) Regulations 2009",Failure to comply within a reasonable time with a direction under R.4(1)(b)82515,"Road Safety (Immobilisation, Removal and Disposal of Vehicles) Regulations 2009",Removing or interfering with an immobilisation notice without authority82516,"Road Safety (Immobilisation, Removal and Disposal of Vehicles) Regulations 2009",Without authority removing or attempting to remove an immobilisation device fixed to a vehicle82517,"Road Safety (Immobilisation, Removal and Disposal of Vehicles) Regulations 2009",Misusing a disabled personÕs badge or concession82518,"Road Safety (Immobilisation, Removal and Disposal of Vehicles) Regulations 2009",Making false declaration with a view to securing release of a vehicle from an immobilisation device82519,"Road Safety (Immobilisation, Removal and Disposal of Vehicles) Regulations 2009",Failure to comply within a reasonable time with a direction under RR.10(1) & 11(1)82520,"Road Safety (Immobilisation, Removal and Disposal of Vehicles) Regulations 2009",Making false declaration with a view to securing possession of a vehicle delivered into custody of a person80200,Road Traffic Act 1988 as amended by Road Traffic Act 1991 ,Dangerous driving408,Road Traffic Act 1988 as amended by Road Safety Act 2006,Causing death by careless or inconsiderate driving (Disqualification obligatory)80401,Road Traffic Act 1988,Careless driving - without due care or attention409,Road Traffic Act 1988 as amended by Road Safety Act 2006,"Causing death by driving: unlicensed, disqualified or uninsured drivers                                                  (Disqualification obligatory)"409,Road Traffic Act 1988 as amended by Road Safety Act 2006,"Causing death by driving: unlicensed, disqualified or uninsured drivers                                                  (Disqualification obligatory)"80301,Road Traffic Act 1988,"Driving or attempting to drive a mechanically propelled vehicle whilst unfit to drive through drink or drugs                                                                                (Only to be used where it is unclear whether it is drink or drugs)"80309,Road Traffic Act 1988,Driving or attempting to drive a mechanically propelled vehicle whilst unfit to drive through drink or drugs - Drink80310,Road Traffic Act 1988,Driving or attempting to drive a mechanically propelled vehicle whilst unfit to drive through drink or drugs - Drugs80304,Road Traffic Act 1988,"Being in charge of mechanically propelled vehicle whilst unfit to drive through drink or drugs         (Only to be used where it is unclear whether it is drink or drugs)"80311,Road Traffic Act 1988,Being in charge of mechanically propelled vehicle whilst unfit to drive through drink or drugs - Drink80312,Road Traffic Act 1988,Being in charge of mechanically propelled vehicle whilst unfit to drive through drink or drugs - Drugs80302,Road Traffic Act 1988,"Driving or attempting to drive a motor vehicle while having a breath, blood or urine alcohol concentration in excess of the prescribed limit"80305,Road Traffic Act 1988,"In charge of a motor vehicle while having a breath, blood or urine alcohol concentration in excess of the prescribed limit"80307,Road Traffic Act 1988,Failing without reasonable excuse to provide a specimen of breath for a preliminary test80306,Road Traffic Act 1988,In charge of a motor vehicle and failing without reasonable excuse to provide a specimen for a laboratory test or two specimens for analysis of breath80303,Road Traffic Act 1988,Driving or attempting to drive a motor vehicle and failing to without a reasonable excuse provide a specimen for a laboratory test or 2 specimens for analysis of breath80308,,a) driving or attempting to drive80308,,b) all other cases80490,Road Traffic Act 1988,Racing on the highway82590,Road Traffic Act 1988,Promoting or taking part in an unauthorised rally82502,Road Traffic Act 1988,Driving or riding in motor vehicle not wearing a seat belt#VALUE!,Road Traffic Act 1988 as amended by Motor Vehicles (Wearing of Seat Belts) (Amendment) Regulations 2006                   ,Carrying child in rear-facing restraining device placed on front seat without air bag being deactivated82502,Road Traffic Act 1988 as amended by Motor Vehicles (Wearing of Seat Belts) (Amendment) Regulations 2006                   ,Failure to notify bus passengers of the requirement to wear seat belts82502,Road Traffic Act 1988,Driving motor vehicle with child not wearing seat belt82401,Road Traffic Act 1988,Driving/riding motor cycle not wearing protective headgear82590,Road Traffic Act 1988,Offences in connection with selling etc protective headgear82090,Road Traffic Act 1988,Prohibition of parking of heavy commercial vehicles on verges and footways82090,Road Traffic Act 1988 ,Driving or parking on cycle track82001,Road Traffic Act 1988 ,Leaving vehicles in dangerous positions511,Road Traffic Act 1988 ,Causing danger by causing anything to be on a road or interfering with a vehicle or traffic equipment82402,Road Traffic Act 1988 ,Unlawful pillion riding13706,Road Traffic Act 1988 ,"Bicycle, more than one person carried"82506,Road Traffic Act 1988 ,Tampering with motor vehicles12408,Road Traffic Act 1988 ,Offences other than those caused by vehicles13704,Road Traffic Act 1988 ,Bicycles being towed80490,Road Traffic Act 1988 ,Driver/passenger holding on to another vehicle for the purpose of being towed11106,Road Traffic Act 1988 ,Offences relating to dogs13711,Road Traffic Act 1988 ,Dangerous riding by pedal cyclist13712,Road Traffic Act 1988 ,Careless riding by pedal cyclist13713,Road Traffic Act 1988,Pedal cyclist riding under the influence of drink or drugs13714,Road Traffic Act 1988,Taking part in unauthorised cycle race on public highway13715,Road Traffic Act 1988,Promoting unauthorised cycle race on public highway409,Road Traffic Act 1988 as amended by Road Safety Act 2006,"Causing death by driving: unlicensed,  disqualified or uninsured drivers                                                  (Disqualification obligatory)"80490,Road Traffic Act 1988 ,Unauthorised motor vehicle trial on footpaths or bridleways81902,Road Traffic Act 1988,Driving on footway82590,Road Traffic Act 1988 ,Driving on Common Land81890,Road Traffic Act 1988,Neglect or refusal to stop when directed by a constable/traffic officer:81890,Road Traffic Act 1988,Neglect or refusal to keep or proceed in line of traffic when directed by a constable or traffic officer81890,Road Traffic Act 1988,"Neglect or refusal to comply with a direction made by a constable/traffic officer, to proceed to a particular point for the purposes of a traffic survey"81811,Road Traffic Act 1988,Failing to comply with traffic signals or signs (motor vehicles) - offences detected by camera devices81801,Road Traffic Act 1988 ,Failing to comply with traffic signals/signs (motor vehicles) - offences NOT detected by camera devices13511,Road Traffic Act 1988 ,Failing to comply with traffic signals/signs - offences related to horse-drawn vehicles13705,Road Traffic Act 1988 ,Failing to comply with traffic signals or signs - offences connected with bicycles12401,Road Traffic Act 1988 ,Pedestrian failing to stop when directed by constable regulating traffic81504,Road Traffic Act 1988,Using vehicle in dangerous condition etc.81501,Road Traffic Act 1988,Brakes defective81502,Road Traffic Act 1988,Steering gear defective81503,Road Traffic Act 1988,Tyres defective82301,Road Traffic Act 1988,"Overloading a goods vehicle, motor vehicle or trailer adapted to carry more than 8 passengers"13602,Road Traffic Act 1988 ,Offences connected with handcarts and barrows82302,Road Traffic Act 1988,Exceeding gross weight or axle weight82390,Road Traffic Act 1988,Other load offences82511,Road Traffic Act 1988,"Breach of requirement as to speed assessment equipment detection devices                        (Disqualification discretionary)"13504,Road Traffic Act 1988 ,Offences relating to horse drawn vehicles81590,Road Traffic Act 1988,Other offences relating to vehicles in dangerous or defective condition82100,Road Traffic Act 1988,Motor Vehicles lighting offences (RVL Regs 1989)81300,Road Traffic Act 1988,Using vehicle without test certificate81300,Road Traffic Act 1988,Various vehicle test offences (excluding fraud)82590,Road Traffic Act 1988,Impersonating or making statement or doing an act to falsely suggest being a stopping officer82590,Road Traffic Act 1988,Resisting or wilfully obstructing a stopping officer exercising powers82590,Road Traffic Act 1988,Driving a goods vehicle while a prohibitive operative82590,Road Traffic Act 1988,Selling etc unroadworthy vehicle or trailer82590,Road Traffic Act 1988,Fitting or selling defective or unsuitable vehicle parts81300,Road Traffic Act 1988,Obstructing examiner testing vehicle to ascertain if defective or unsuitable part has been fitted etc 82599,Road Traffic Act 1988,Failing to comply with requirement about weighing motor vehicle or obstructing authorised person13730,Road Traffic Act 1988,Pedal cycle lighting and reflector offences (RVL Regs 1984)82590,Road Traffic Act 1988,Selling etc wrongly made tail lamps or reflectors80702,Road Traffic Act 1988,"Driving, causing or permitting a person to drive other than in accordance with a licence (full or provisional) (except HGV)"80704,Road Traffic Act 1988,Driving after false declaration as to physical fitness; driving after failing to declare; driving after refusal or revocation80790,Road Traffic Act 1988,Failure to notify Secretary of State of a deterioration in relevant or prospective disability80790,Road Traffic Act 1988,Driving with uncorrected eyesight; refusing to submit to eyesight test80706,Road Traffic Act 1988,Driving licence holder failing to surrender licence and counterpart80790,Road Traffic Act 1988 ,Fail to surrender licence and notify change of particulars; fail to state date of birth or sex80790,Road Traffic Act 1988,Obtaining driving licence while disqualified80701,Road Traffic Act 1988 ,Driving while disqualified80790,Road Traffic Act 1988 ,Driving heavy goods vehicle without HGV licence80790,Road Traffic Act 1988 ,Other HGV licence related offences82590,Road Traffic Act 1988,Giving paid instruction when not a registered or licensed person82513,Road Traffic Act 1988,Giving or allowing paid driving instruction in contravention of S.123(1)(a) of the Act82590,Road Traffic Act 1988 ,Falsely claiming to be a registered driving instructor412,Road Traffic Act 1988,Cause serious injury by dangerous driving80901,Road Traffic Act 1988 ,Using motor vehicle uninsured against third party risks80903,Road Traffic Act 1988,Keeping vehicle which does not meet insurance requirements80990,Road Traffic Act 1988 ,Failing to surrender insurance certificate or make statutory declaration of loss make statutory declaration of loss80990,Road Traffic Act 1988 ,Failing to give information about insurance on demand by person making claim2011,Road Traffic Act 1988,Contravention of regulations in connection with immobilisation device82013,Road Traffic Act 1988,Contravention of regulations in connection with display of disabled personÕs badge82012,Road Traffic Act 1988,Contravention of regulations in connection with securing possession of vehicles81890,Road Traffic Act 1988 ,Failing to stop motor vehicle when required by police officer in uniform13799,Road Traffic Act 1988 ,Failing to stop pedal cycle when required by constable80703,Road Traffic Act 1988,Failing to produce driving licence80790,Road Traffic Act 1988 ,Failing to state date of birth or sex or to furnish evidence of date of birth or name at time of birth80790,Road Traffic Act 1988 ,Making a false statement to obtain or failure to produce revoked licence or licence believed to have been obtained by false statement80990,Road Traffic Act 1988,Failing to produce insurance certificate (not after accident)80990,Road Traffic Act 1988 ,Owner failing to give information as to insurance to police81300,Road Traffic Act 1988 ,Failing to produce test certificate82590,Road Traffic Act 1988 ,Failing to produce goods vehicle plating or test certificate82503,Road Traffic Act 1988,Driver or person accompanying holder of provisional licence failing to give his or owner's name and address to police officer on demand82503,Road Traffic Act 1988,"Failing to give name and address or give false name and address when alleged to have been driving recklessly, dangerously, carelessly or inconsiderately"13720,Road Traffic Act 1988 ,"Rider of cycle failing to give name & address when alleged to have been cycling recklessly, dangerously, carelessly or inconsiderately"12402,Road Traffic Act 1988,Pedestrian contravening constable's direction to stop to give name & address80503,Road Traffic Act 1988 ,Failing to give name and address after accident80501,Road Traffic Act 1988 ,Failing to stop after accident80502,Road Traffic Act 1988,Failing to report accident within 24 hours80990,Road Traffic Act 1988 ,Failing to produce certificate of insurance after accident80990,Road Traffic Act 1988,Owner failing to give information as to insurance to police82508,Road Traffic Act 1988,Person keeping vehicle failing to give driver's name and address on demand81405,Road Traffic Act 1988 ,"Operator's licence - using, lending etc with intent to deceive"81406,Road Traffic Act 1988 ,"Test certificate - fraudulently using, lending or altering"81402,Road Traffic Act 1988 ,"With intent to deceive, forging etc certificate of insurance"81401,Road Traffic Act 1988 ,"With intent to deceive, forging etc licence, or making document resembling"80705,Road Traffic Act 1988,Making false statement to obtain or failure to produce revoked licence81408,Road Traffic Act 1988 ,"Making false statement or producing, providing, sending or otherwise making use of a document  knowing it  to be false for purposes of either SS.53-60& 63 of Road Traffic Act 1988 or of Regulations made under SS.49-51, 61, 62 & 66(3)"81002,Road Traffic Act 1988 ,Making false statement or producing false evidence for the purposes of Regulations under S.66(1) of this Act (applying for a licence under Vehicles (Excise) Act 1971)81409,Road Traffic Act 1988 ,"Wilfully, or with intent to deceive, making a false entry in any record required to be made or kept by regulations under S.74 (operatorÕs duty to inspect, and keep records of inspections of, goods vehicles)"80902,Road Traffic Act 1988 ,Making false statement or withholding material information in order to obtain the issue of a certificate of insurance82590,Road Traffic Act 1988 ,Falsely representing to be a vehicle testing examiner19527,Road Traffic Act 1988,Other offences not connected with driving motor vehicles80703,Road Traffic (New Drivers) Act 1995,New driver convicted of offence involving obligatory endorsement failing to produce driving test certificate80790,Road Traffic Offenders Act 1988,Failure to produce licence for endorsement by court 82510,Road Traffic Offenders Act 1988,Interference etc. with alcohol ignition interlock82004,Road Traffic Offenders Act 1988,Removing or interfering with any fixed penalty notice fixed to a vehicle without authority82509,Road Traffic Offenders Act 1988,Driving etc vehicle in contravention of prohibition of failure to pay financial penalty deposit etc.82590,Road Traffic (Foreign Vehicles) Act 1972,Driving a goods vehicle while a prohibition operative13511,Road Traffic Regulation Act 1984,Offences related to horse drawn vehicles81802,Road Traffic Regulation Act 1984,Contravention of traffic regulation order - other than parking offences82090,Road Traffic Regulation Act 1984,Contravention of traffic regulation order - various parking offences16311,Road Traffic Regulation Act 1984,Contravention of orders regulating traffic in Greater London - pedestrian and non-vehicular street offences only82090,Road Traffic Regulation Act 1984,Contravention of orders regulating traffic in Greater London - vehicular street offences16411,Road Traffic Regulation Act 1984,Contravention of experimental traffic order81802,Road Traffic Regulation Act 1984,Contravention of temporary prohibition of traffic on roads81601,Road Traffic Regulation Act 1984,Contravention of temporary speed limit on roads (offences not detected by camera devices)81611,Road Traffic Regulation Act 1984,Contravention of temporary speed limit on roads (offences detected by camera devices)13511,Road Traffic Regulation Act,Offences relating to horse drawn vehicles81890,Road Traffic Regulation Act 1984,Use of special road contrary to scheme or regulations12204,Road Traffic Regulation Act 1984,Obstructions other than those caused by vehicles12205,Road Traffic Regulation Act 1984,Obstructions other than those caused by vehicles13514,Road Traffic Regulation Act 1984,Offences relating to horse drawn vehicles13606,Road Traffic Regulation Act 1984,Offences connected with handcarts & barrows13716,Road Traffic Regulation Act 1984,Offences connected with pedal cycles81890,Road Traffic Regulation Act 1984,One way traffic on trunk roads81802,Road Traffic Regulation Act 1984,Contravention of prohibition or restriction for roads of certain classes82390,Road Traffic Regulation Act 1984,Exceeding weight limit on specified road or bridge13708,Road Traffic Regulation Act 1984,Offences connected with pedal cycles; in relation to pedestrian crossings81901,Road Traffic Regulation Act 1984,By moving vehicle: Failing to accord precedence to foot passengers12203,Road Traffic Regulation Act 1984,Obstructions other than those caused by vehicles at pedestrian crossings13512,Road Traffic Regulation Act 1984,Offences related to horse drawn vehicles at pedestrian crossings13604,Road Traffic Regulation Act 1984,Offences connected with handcarts and barrows at pedestrian crossings81890,Road Traffic Regulation Act 1984,Not stopping at school crossing13513,Road Traffic Regulation Act 1984,Offences related to horse drawn vehicles13605,Road Traffic Regulation Act 1984,Offences connected with handcarts and barrows 13709,Road Traffic Regulation Act 1984,Pedal cycles - failing to obey signal81901,Road Traffic Regulation Act 1984,Driving in a play street81901,Road Traffic Regulation Act 1984,Other contravention of street playground order82090,Road Traffic Regulation Act 1984,Offences against statutory waiting restrictions82590,Road Traffic Regulation Act 1984,Interference with apparatus for collecting charges17312,Road Traffic Regulation Act 1984,To ply for hire or to accept passenger for hire within a parking place82090,Road Traffic Regulation Act 1984,Designated Parking Places under section 45 RTRA 1984 Ð offences82090,Road Traffic Regulation Act 1984,Parking meter zones - meter and other offences82590,Road Traffic Regulation Act 1984,Offences by non-drivers against parking place orders82590,Road Traffic Regulation Act 1984,Tampering with parking meter with intent to defraud81601,Road Traffic Regulation Act 1984,Speeding81611,Road Traffic Regulation Act 1984,Speeding offences detected by camera devices81601,Road Traffic Regulation Act Act,"Speeding - Goods, Passenger carrying or other vehicle"81611,Road Traffic Regulation Act 1984,Speeding offences detected by camera devices82590,Road Traffic Regulation Act 1984,Interference with immobilisation device82501,Road Traffic Regulation Act 1984,Non-compliance with notice (excess charge)82590,Road Traffic Regulation Act 1984,Failing to give information as to identity of driver81407,Road Traffic Regulation Act 1984,Mishandling or faking parking documents82590,Road Traffic Regulation Act 1984,Wrongful use of disabled person's badge82590,Road Traffic Regulation Act 1984,Removal of/interference with fixed penalty notice82501,Road Traffic Regulation Act 1984,Non-compliance with notice to owner (fixed penalty)17313,Road Transport (International Passenger Services)  Regulations 1984,Offences81200,Road Transport (Passenger Vehicles Cabotage) Regulations 1999,"Using, causing or permitting use of vehicle for UK cabotage operations by a Community carrier without a valid Community licence"81200,Road Transport (Passenger Vehicles Cabotage) Regulations 1999,"Using, causing or permitting use of vehicle for UK cabotage operations inside GB or between GB and N Ireland in contravention of A.6(1) "81501,Road Vehicles (Construction & Use) Regulations 1986,Brakes defective80490,Road Vehicles (Construction & Use) Regulations 1986,Application of brakes of trailers82590,Road Vehicles (Construction & Use) Regulations 1986,Trailer not equipped with suitable/sufficient spring81503,Road Vehicles (Construction & Use) Regulations 1986,Tyres defective81502,Road Vehicles (Construction & Use) Regulations 1986,Maintenance of steering gear